{
  "schema": "kalama.patch-assist-prototype/agent-proposal/v1",
  "experiment_id": "EXP-BASH-7X9B-01",
  "run_id": "B9X4K",
  "action_id": "patch-001",
  "proposal_revision": 1,
  "candidate_binding": {
    "run_id": "B9X4K",
    "action_id": "patch-001",
    "pack_sha256": "35ee44588ee913590b71e241695e299ebfdece631c8cc23b939511b64479fa5a"
  },
  "fields": {
    "fix_type": {
      "value": null,
      "status": "ABSTAINED",
      "evidence_refs": [],
      "confidence": "LOW",
      "reason_summary": "Pack audit lists FixType{A,B,C} without in-pack semantic mapping; no retrieved source maps this jessie backport to a specific value."
    },
    "strategy": {
      "value": null,
      "status": "ABSTAINED",
      "evidence_refs": [],
      "confidence": "LOW",
      "reason_summary": "No explicit strategy label in retrieved sources and fix_type unresolved; abstaining rather than inferring from general OS knowledge."
    },
    "target_version": {
      "value": "4.3-11+deb8u2",
      "status": "PROPOSED",
      "evidence_refs": ["SEED-01", "S005", "S006", "S007", "S011"],
      "confidence": "HIGH",
      "reason_summary": "Scanner fixed version equals Debian jessie fixed version via DLA-1726-1 and security archive index; corroborated by NVD/OSV records."
    },
    "artifact_source": {
      "value": "http://archive.debian.org/debian-security/pool/updates/main/b/bash/bash_4.3-11+deb8u2_amd64.deb",
      "status": "PROPOSED",
      "evidence_refs": ["S011", "S012"],
      "confidence": "HIGH",
      "reason_summary": "Exact artifact path from S011 stanza; S012 retrieval confirms bytes with matching SHA-256 and size."
    },
    "source_identifier": {
      "value": "pool/updates/main/b/bash/bash_4.3-11+deb8u2_amd64.deb",
      "status": "PROPOSED",
      "evidence_refs": ["S011"],
      "confidence": "HIGH",
      "reason_summary": "Filename field of the S011 fixed-version stanza for bash 4.3-11+deb8u2."
    },
    "build_system": {
      "value": null,
      "status": "NOT_APPLICABLE",
      "evidence_refs": [],
      "confidence": "HIGH",
      "reason_summary": "Debian .deb artifact update; production build vocabulary locked to maven so no build system applies."
    },
    "command": {
      "value": null,
      "status": "ABSTAINED",
      "evidence_refs": [],
      "confidence": "LOW",
      "reason_summary": "Gated INSUFFICIENT by evidence_sufficiency.command; L5 procedure documentation missing."
    },
    "validation_command": {
      "value": null,
      "status": "ABSTAINED",
      "evidence_refs": [],
      "confidence": "LOW",
      "reason_summary": "Gated INSUFFICIENT by evidence_sufficiency.validation_command; L5 procedure documentation missing."
    },
    "notes": {
      "value": "Target 4.3-11+deb8u2 preserves Debian jessie backport for CVE-2019-9924 via DLA-1726-1 (not upstream 4.4-1); fixed .deb stanza lists Depends/Pre-Depends closure with checksum match; KEV checked-negative.",
      "status": "PROPOSED",
      "evidence_refs": ["SEED-01", "S007", "S008", "S011", "S012"],
      "confidence": "MEDIUM",
      "reason_summary": "Display-only scope and provenance boundaries supported by tracker, KEV, index, and artifact records."
    }
  },
  "abstentions": [
    {
      "field": "fix_type",
      "reason_code": "FIX_TYPE_UNRESOLVED",
      "detail": "Pack audit lists FixType{A,B,C} without in-pack semantic mapping; no retrieved source maps this backport to a specific value."
    },
    {
      "field": "strategy",
      "reason_code": "PATCH_STRATEGY_UNRESOLVED",
      "detail": "No explicit strategy label in retrieved sources; fix_type unresolved so consistency cannot be shown; abstaining rather than inferring."
    },
    {
      "field": "build_system",
      "reason_code": "BUILD_SYSTEM_NOT_APPLICABLE",
      "detail": "Debian .deb artifact; production build vocabulary locked to maven; no build system applies."
    },
    {
      "field": "command",
      "reason_code": "COMMAND_GATE_INSUFFICIENT",
      "detail": "evidence_sufficiency.command=INSUFFICIENT (L5 missing, PROCEDURE_UNKNOWN); value remains null per gate."
    },
    {
      "field": "validation_command",
      "reason_code": "VALIDATION_COMMAND_GATE_INSUFFICIENT",
      "detail": "evidence_sufficiency.validation_command=INSUFFICIENT (L5 missing); value remains null per gate."
    }
  ],
  "assumptions": [
    "Target architecture is amd64 as stated in PURL and fixed artifact filename; no cross-arch claim."
  ],
  "warnings": [
    "Scope is patch-001 only: bash Debian OS package; observed /usr/local/bash-4.3.0 source build is out of scope and not claimed fixed.",
    "Incidental CVE-2016-9401 listed by scanner is not separately addressed by this proposal.",
    "Debian 8.10 jessie is EOSL; archive source is historical.",
    "DLA-1726-1 full announcement text unreachable (S001 FETCH_FAILED) and NVD detail page unreachable (S002 FETCH_FAILED); DLA facts carried by OSV/tracker/index records.",
    "L4/L5 missing: no compatibility rationale beyond jessie backport and no deployment procedure; command fields remain null.",
    "Do not interpret scanner FixedVersion as universal; upstream 4.4-1 noted but jessie backport 4.3-11+deb8u2 preserved."
  ],
  "proposal_sha256": "a3f7ba38d1a6f4de4f8282879c34ab49fd5ec3c336d0bf4a872a3c34136cb631",
  "created_at": "2026-09-18T10:30:00Z"
}
