{"abstentions": [{"detail": "Pack vocabulary FixType{A,B,C} has no evidence-grounded mapping for this candidate at L1; no artifact or procedure evidence to select a type. Abstaining per correct-abstention rule.", "field": "fix_type", "reason_code": "FIX_TYPE_UNRESOLVED"}, {"detail": "evidence_sufficiency.patch_strategy is PARTIAL with L3/L4/L5 missing and no deployment procedure in this arm. No strategy proposed to avoid inferring from general OS knowledge.", "field": "strategy", "reason_code": "PATCH_STRATEGY_UNRESOLVED"}, {"detail": "evidence_sufficiency.artifact_provenance is INSUFFICIENT; missing_evidence ARTIFACT_SOURCE_UNRESOLVED: no fixed .deb location, availability, or hashes at L1.", "field": "artifact_source", "reason_code": "ARTIFACT_SOURCE_UNRESOLVED"}, {"detail": "No retrieved artifact identifier in this arm; artifact_provenance is INSUFFICIENT so no coordinate may be proposed.", "field": "source_identifier", "reason_code": "ARTIFACT_SOURCE_UNRESOLVED"}, {"detail": "No build metadata retrieved in this arm and dependency_closure is INSUFFICIENT; no build system value is supported.", "field": "build_system", "reason_code": "DEPENDENCY_ARTIFACT_UNREACHABLE"}, {"detail": "evidence_sufficiency.command is INSUFFICIENT (L5 not satisfied; PROCEDURE_UNKNOWN). Command remains null per hard gate.", "field": "command", "reason_code": "COMMAND_GATE_INSUFFICIENT"}, {"detail": "evidence_sufficiency.validation_command is INSUFFICIENT (L5 not satisfied; PROCEDURE_UNKNOWN). Validation command remains null per hard gate.", "field": "validation_command", "reason_code": "VALIDATION_GATE_INSUFFICIENT"}], "action_id": "patch-001", "assumptions": ["target_version is interpreted within the debian 8 deb8u backport lineage stated by the scanner record, not as an upstream version-family recommendation.", "Production FixType/strategy vocabulary is taken from the audited production contract; no new strategy is introduced."], "candidate_binding": {"action_id": "patch-001", "pack_sha256": "c7d22143166595953bc28f757903945855eff1e040a18cfaa888d1f8f79e25f2", "run_id": "B9X4K"}, "created_at": "2026-09-18T11:00:00Z", "experiment_id": "EXP-BASH-7X9B-01", "fields": {"artifact_source": {"confidence": "LOW", "evidence_refs": [], "reason_summary": "Artifact provenance is INSUFFICIENT; no fixed .deb location or hashes in this arm.", "status": "ABSTAINED", "value": null}, "build_system": {"confidence": "LOW", "evidence_refs": [], "reason_summary": "No build metadata in this arm; dependency closure is INSUFFICIENT.", "status": "ABSTAINED", "value": null}, "command": {"confidence": "LOW", "evidence_refs": [], "reason_summary": "Gated: evidence_sufficiency.command is INSUFFICIENT, so no command is proposed.", "status": "ABSTAINED", "value": null}, "fix_type": {"confidence": "LOW", "evidence_refs": [], "reason_summary": "No evidence-grounded FixType mapping available at L1; abstaining rather than guessing.", "status": "ABSTAINED", "value": null}, "notes": {"confidence": "MEDIUM", "evidence_refs": ["SEED-01", "S003", "S004"], "reason_summary": "Scope and version basis as supported by scanner record plus retrieved upstream entries; DLA prose unavailable.", "status": "PROPOSED", "value": "Scanner-bound candidate is the debian OS package bash 4.3-11+deb8u1 with scanner FixedVersion 4.3-11+deb8u2 (DLA-1726-1). Adjacent source-built /usr/local/bash-4.3.0 is out of scope for patch-001. DLA announcement prose was unreachable in this arm, so the version rests on the scanner record plus the retrieved upstream fix entry. No fixed .deb location, hashes, or deployment procedure are present in this arm."}, "source_identifier": {"confidence": "LOW", "evidence_refs": [], "reason_summary": "No retrieved artifact identifier in this arm; artifact provenance is INSUFFICIENT.", "status": "ABSTAINED", "value": null}, "strategy": {"confidence": "LOW", "evidence_refs": [], "reason_summary": "patch_strategy is PARTIAL with L3/L4/L5 missing; evidence does not establish a strategy.", "status": "ABSTAINED", "value": null}, "target_version": {"confidence": "MEDIUM", "evidence_refs": ["SEED-01", "S004"], "reason_summary": "Scanner FixedVersion 4.3-11+deb8u2 for debian bash, corroborated by retrieved upstream fix entry; DLA prose unreachable so confidence is MEDIUM.", "status": "PROPOSED", "value": "4.3-11+deb8u2"}, "validation_command": {"confidence": "LOW", "evidence_refs": [], "reason_summary": "Gated: evidence_sufficiency.validation_command is INSUFFICIENT, so no validation command is proposed.", "status": "ABSTAINED", "value": null}}, "proposal_revision": 1,   "proposal_sha256": "5eb61cd1bb2aa20c3712fdb622df86164cb832375d997d988a7ec95bcbb85dd2", "run_id": "B9X4K", "schema": "kalama.patch-assist-prototype/agent-proposal/v1", "warnings": ["DLA-1726-1 announcement prose was unreachable in this arm (S001 fetch failed); version recommendation rests on scanner FixedVersion plus upstream fix entry.", "No fixed .deb location, availability, hashes, dependency metadata, or deployment procedure in this arm; artifact, dependency, command, and validation fields are abstained.", "Adjacent source-built /usr/local/bash-4.3.0 observed in image history is out of scope for patch-001 and is not claimed as fixed by this proposal.", "Scanner record lists incidental CVE-2016-9401 alongside CVE-2019-9924; this proposal reasons only about the patch-001 candidate and makes no remediation claim for any other finding.", "Image OS is debian 8.10 (EOSL) per runtime evidence; compatibility beyond the stated deb8u backport version is not established in this arm."]}