{"abstentions": [{"detail": "evidence_sufficiency.command INSUFFICIENT from PROCEDURE_UNKNOWN gap; value null.", "field": "command", "reason_code": "COMMAND_GATE_INSUFFICIENT"}, {"detail": "evidence_sufficiency.validation_command INSUFFICIENT; value null.", "field": "validation_command", "reason_code": "VALIDATION_GATE_INSUFFICIENT"}], "action_id": "patch-001", "assumptions": ["Contract used only for vocabulary and pairings; all facts from pack.", "No live execution or retrieval performed."], "candidate_binding": {"action_id": "patch-001", "pack_sha256": "0c5e127b1eba7997a181de6035cdbb3cfa237752db4a29cfc4d4723ccbe55101", "run_id": "6WUM1"}, "created_at": "2026-10-11T13:20:00Z", "experiment_id": "EXP-PROC-7X9D-01", "fields": {"artifact_source": {"confidence": "HIGH", "evidence_refs": ["S010", "S011"], "reason_summary": "Index Filename field derives artifact path; retrieved artifact bytes match index size and SHA-256.", "status": "PROPOSED", "value": "http://archive.debian.org/debian-security/pool/updates/main/a/apache2/apache2_2.4.10-10+deb8u16_amd64.deb"}, "build_system": {"confidence": "HIGH", "evidence_refs": [], "reason_summary": "Contract reserves build system for FixType A source builds; this case is FixType C so no build system applies.", "status": "NOT_APPLICABLE", "value": null}, "command": {"confidence": "LOW", "evidence_refs": [], "reason_summary": "Pack gate evidence_sufficiency.command is INSUFFICIENT from missing procedural documentation; no remediation instruction proposed.", "status": "ABSTAINED", "value": null}, "fix_type": {"confidence": "HIGH", "evidence_refs": ["SEED-01", "S009", "S010"], "reason_summary": "Pack identifies component as debian OS package apache2 with deb ecosystem; contract routes deb ecosystems to OS-package provider.", "status": "PROPOSED", "value": "C"}, "notes": {"confidence": "MEDIUM", "evidence_refs": ["S006", "S007", "S008", "S010", "S011"], "reason_summary": "Notes summarize cited index, artifact, closure, and feed facts without asserting outcomes.", "status": "PROPOSED", "value": "Live security index provides later revision within same lineage; scanner-indicated revision absent from live index and superseded; snapshot list contains all three revisions; downloaded artifact bytes match index checksums; dependency closure complete with version-pinned siblings present; KEV feed checked-negative for both CVEs; release-significance gap recorded and installability not asserted beyond index presence."}, "source_identifier": {"confidence": "HIGH", "evidence_refs": ["S010", "S011"], "reason_summary": "Filename field of the live security index stanza identifies the artifact within the pool.", "status": "PROPOSED", "value": "pool/updates/main/a/apache2/apache2_2.4.10-10+deb8u16_amd64.deb"}, "strategy": {"confidence": "HIGH", "evidence_refs": ["S005", "S006", "S010"], "reason_summary": "Default pairing for OS-package fix type; advisory and index evidence support package-manager remediation path.", "status": "PROPOSED", "value": "PACKAGE_MANAGER"}, "target_version": {"confidence": "HIGH", "evidence_refs": ["S008", "S010", "S011"], "reason_summary": "Live jessie security index stanza carries this revision with matching artifact bytes; snapshot list contains installed, scanner-indicated, and this revision; preserves lineage and arch while superseding scanner-indicated revision absent from live index.", "status": "PROPOSED", "value": "2.4.10-10+deb8u16"}, "validation_command": {"confidence": "LOW", "evidence_refs": [], "reason_summary": "Pack gate evidence_sufficiency.validation_command is INSUFFICIENT; no verification instruction proposed.", "status": "ABSTAINED", "value": null}}, "proposal_revision": 1, "proposal_sha256": "dae5cb7f7489a5005a4f9740e844d4afa7c2dc20881449b3d1c41f04d51b1843", "run_id": "6WUM1", "schema": "kalama.patch-assist-prototype/agent-proposal/v1", "warnings": ["Scanner-indicated revision deb8u15 absent from live index; proposal targets indexed revision deb8u16 with significance gap RELEASE_RATIONALE_UNINTERPRETED.", "Incidental CVE-2019-10098 shares vendor record DLA-1900-1 but is out of scope for patch-001; no claim made about it."]}